word_count,num_named_entities,avg_sentence_length,num_quotes,has_numbers,publish_hour,source_type,author_article_count,article_shares,reading_time_minutes,sentiment_score,num_images,article_text,category
12,4,27.6,2,1,14,0,31,141,4.7,0.135,2,market market global growing security athlete state country called president announced president,Sports
14,5,3.1,0,1,16,0,14,76,7.5,0.574,4,sanctions economic called sanctions national first impact including local also first president could reported,World
10,1,21.0,0,1,22,3,8,600,6.7,0.334,4,security would called local market last program officials new algorithm,Technology
18,4,11.0,0,0,15,4,11,15,7.8,-0.027,0,country called market reported new sector first quarterly percent technology country market last world first could announced industry,Business
13,0,17.1,1,1,5,2,60,20,6.7,-0.467,2,health major security many plan concerns quantum new including global announced public could,Science
10,0,15.9,1,0,7,1,1,10,5.7,-0.338,1,people million concerns international million plan expected athlete country national,Sports
13,2,21.3,2,0,21,1,13,154,5.0,-0.088,1,president research plan public plan percent NASA also local officials first world plan,Science
13,6,17.1,0,1,5,2,8,0,4.9,0.292,1,policy system report concerns expected said said said would summit reported would including,World
10,2,20.3,0,1,3,1,4,26,7.8,-0.371,2,state said local said market international legislation called would new,Politics
9,1,5.1,1,1,22,1,20,8,6.9,-0.363,1,industry country officials percent also market president including premiere,Entertainment
13,2,17.9,2,0,13,2,61,106,7.7,-0.242,1,security million officials expected last startup announced health next security people international officials,Technology
13,4,11.7,1,1,20,1,160,184,6.9,0.141,0,national future last diplomat security concerns expected research percent announced according economic percent,World
9,3,8.8,3,1,19,3,65,95,6.4,-0.1,1,leader system development research global officials country last shareholders,Business
16,1,10.1,1,1,23,1,3,33,7.7,0.25,3,market president security bipartisan reported also national including sector many would local policy many country health,Politics
13,5,21.9,0,0,7,1,7,7,5.4,0.49,1,international people app leader global president company global development policy president year major,Technology
12,5,23.3,1,1,5,1,55,126,4.3,-0.075,0,said health also future expected app growing system public group year app,Technology
16,3,20.5,1,1,19,1,26,182,4.2,-0.03,4,concerns year people impact security announced would company growing expected research could could announced state called,Politics
15,5,10.2,2,1,0,4,1,12,1.8,0.229,3,market recent next country leader national leader major diagnosis international group future percent public reported,Health
10,1,13.2,0,0,2,2,48,73,1.0,0.218,1,last including industry new recent international reported next last quantum,Science
11,4,15.8,1,0,19,4,85,6,6.4,0.086,3,state according decision NASA policy people company could group company industry,Science
14,5,14.8,0,0,20,2,31,224,7.3,-0.076,3,world market world bipartisan million according leader public country world also new new bipartisan,Politics
9,3,10.0,0,1,15,2,23,30,7.5,-0.145,2,expected expected reported said group coach future market health,Sports
12,3,19.2,3,1,14,2,172,108,6.7,-0.068,2,local local year global new policy president people percent last system country,Science
18,3,16.8,1,0,10,2,135,55,7.5,0.046,2,global country industry impact country state report decision government economic decision senator state organization system program first impact,Politics
12,1,19.8,0,0,15,2,46,9828,7.3,0.094,2,major sanctions president concerns next leader major recent next leader sector country,World
12,2,15.1,3,0,12,0,199,57,3.6,0.262,0,according concerns market decision world reported sector national diagnosis impact plan major,Health
11,0,4.6,1,1,0,4,160,8,1.9,-0.263,3,called also called million health last last policy merger state public,Business
11,0,18.7,0,1,18,1,1,16,5.2,-0.003,3,announced public country percent local recent plan national year last merger,Business
8,2,9.8,0,1,10,0,35,0,5.1,-0.091,3,world sector impact last new concerns including state,Business
16,4,18.6,2,1,20,4,4,799,3.1,-0.195,1,including called last million expected leader economic percent announced government recent last premiere organization year research,Entertainment
18,4,12.5,0,0,10,0,26,5,7.1,0.553,1,plan security government last system president world sector program state industry last tournament million report championship according called,Sports
14,6,23.4,0,1,8,1,32,2,8.1,-0.143,1,economic plan announced global percent said concerns president new sector system research including coach,Sports
17,5,22.9,0,1,19,0,5,259,4.0,0.024,3,world public sanctions announced sector president company concerns leader health growing world president country new major country,World
15,5,13.1,0,1,4,1,24,4,3.5,0.409,1,year last plan international country policy championship group said called last decision international year security,Sports
11,3,25.4,0,1,13,1,6,146,1.2,0.302,5,next summit national leader expected impact reported according new health decision,World
16,2,16.3,1,0,18,1,57,1057,1.3,-0.129,4,report NASA world research company many called growing global next next reported people impact called called,Science
8,4,18.3,2,1,4,0,24,233,4.8,-0.001,2,people announced leader would international new health next,Science
13,4,23.2,1,0,1,0,24,515,7.5,0.195,2,program leader clinical trial government people million including market major report research expected,Health
13,3,18.2,2,0,4,4,8,1,2.3,0.167,2,reported last percent research many genome country government company report local impact plan,Science
17,4,30.4,3,1,9,3,24,286,3.1,-0.343,2,last senator government policy year economic world group country people leader company could expected program percent world,Politics
11,1,18.0,2,0,11,1,60,591,8.0,0.106,3,percent box office next security impact organization research would celebrity report,Entertainment
8,1,22.6,2,1,4,2,3,34,7.1,-0.03,1,new group according next year also security recent,Technology
12,2,14.2,1,1,16,2,1,115,4.6,0.226,2,company development recent FDA next government concerns impact public reported technology local,Health
18,1,22.3,0,0,19,2,70,74,5.4,0.61,2,market including people growing global concerns world technology clinical trial said said country concerns including global would next,Health
10,5,15.4,0,0,15,2,1,1966,3.8,0.097,4,company industry research development athlete program major program president last,Sports
15,4,15.3,1,1,19,1,1,47,5.6,-0.356,0,said according including plan development year percent percent expected concerns diagnosis local market said security,Health
9,1,27.1,2,1,11,2,131,10,8.0,-0.078,2,new percent said including tournament health development local international,Sports
11,6,13.3,0,1,17,3,89,650,6.3,0.033,2,development diagnosis according announced research research research world report first also,Health
14,2,23.6,0,1,18,1,73,14,3.3,-0.347,2,expected decision national world according partisan economic recent local last security impact recent security,Politics
12,4,19.8,1,0,10,1,192,42,5.6,-0.595,1,partisan group program concerns concerns people program health reported many technology leader,Politics
14,1,26.2,2,0,2,3,25,42,3.4,-0.191,4,called NASA future many officials state recent public percent research country percent impact state,Science
18,2,23.2,0,1,12,1,14,10,5.3,-0.391,2,would would also future expected group program said people industry app local major decision international global system research,Technology
15,2,18.9,0,1,0,1,98,96,6.2,0.237,4,global global including market research system announced people streaming country company industry decision president reported,Entertainment
9,4,22.6,2,0,15,3,36,28,7.2,-0.178,0,could would expected sector many merger development country research,Business
17,3,21.4,0,1,20,3,38,30,8.3,0.262,1,national million health would new officials president called president earnings organization recent reported public country international industry,Business
16,3,15.8,2,0,17,2,45,9,3.2,0.017,2,box office organization growing policy recent health expected sector security also government health according health impact,Entertainment
10,1,21.0,1,1,4,3,33,7,7.3,0.067,2,leader last concerns president merger security impact local market technology,Business
19,5,26.5,2,0,14,0,12,56,3.3,0.175,2,senator national according would economic economic security world next according security economic year bipartisan development major new next decision,Politics
10,3,14.7,1,0,20,2,42,161,5.0,0.018,2,many future called major according national recent people group earnings,Business
18,3,28.5,2,1,19,2,2,160,8.8,0.099,1,government major world senator future president percent many group world concerns would group report percent many reported country,Politics
17,2,18.0,0,1,13,3,3,17,5.9,0.113,3,plan national state president sector sector public system streaming major reported organization market global world year sector,Entertainment
17,5,19.1,0,1,20,4,13,26,5.9,0.482,0,new major first also health reported said growing celebrity local new report could group technology decision national,Entertainment
13,2,20.3,1,1,15,2,70,29,5.2,0.005,1,first sector organization major technology next group according NASA policy future organization health,Science
17,4,27.5,2,1,12,0,68,375,1.4,-0.442,3,sector according international public first leader concerns streaming people president announced officials said company program announced according,Entertainment
9,2,17.2,2,1,2,3,92,12,6.4,-0.52,2,market also world diplomat plan country last policy impact,World
9,2,17.1,0,0,4,2,29,2549,6.4,-0.118,5,people sector genome expected health impact economic market leader,Science
13,4,15.0,1,0,9,0,48,388,7.0,0.198,2,quantum impact organization country technology country called market security growing according called officials,Science
9,1,17.6,2,0,14,0,47,17687,6.6,-0.091,5,could policy growing group national president plan new future,Entertainment
15,3,22.0,2,0,23,1,6,59,6.8,-0.029,2,local system according refugees research international group country expected many company state first announced year,World
13,2,18.1,1,0,7,0,35,5,5.7,-0.016,5,new also concerns major could major public celebrity according next last leader world,Entertainment
14,6,23.7,0,0,5,4,10,197,6.6,-0.224,0,company expected called plan state health technology plan would health impact technology company diagnosis,Health
13,4,21.1,1,0,1,3,74,137,3.0,-0.714,0,officials people next report officials quarterly impact health growing plan research state first,Business
12,5,20.7,2,1,16,3,32,1,5.3,0.036,1,expected organization major year market would also company many program recent system,World
17,5,16.1,0,1,19,3,131,52,3.0,-0.308,1,reported many new security group next impact public bipartisan year leader policy impact including report president global,Politics
18,1,15.4,0,0,18,3,63,582,6.5,0.172,2,president according new policy sector government concerns state many country local system program would would health quarterly according,Business
16,4,19.9,4,0,16,0,160,218,2.9,0.099,1,next decision reported research last development app market percent last organization also group industry new could,Technology
9,1,20.7,4,0,13,4,25,101,3.3,-0.233,3,technology state including last quantum called would group many,Science
21,3,13.9,0,0,4,4,28,126,5.3,-0.158,3,said local decision clinical trial major clinical trial recent organization could organization president report million officials announced country including last decision,Health
19,1,16.4,2,0,17,0,39,166,3.8,0.432,3,group security government reported million policy many policy global earnings industry company local security shareholders future national sector company,Business
10,2,18.7,2,1,13,4,67,22,8.5,0.149,0,security research organization report coach first officials group government health,Sports
10,0,15.2,1,0,23,2,5,348,4.0,0.029,2,new growing first report said senator program organization expected global,Politics
10,1,21.3,2,1,21,4,18,8,6.2,-0.06,1,group world future vaccine many according concerns market would sector,Health
10,4,20.3,1,0,1,2,4,3,2.0,-0.097,2,president would reported program box office security world announced world,Entertainment
15,2,25.5,1,1,14,4,44,27,1.0,0.025,2,group major concerns international announced local coach system reported first policy public called million system,Sports
10,2,20.4,0,0,5,0,11,203,5.9,0.318,1,next national policy senator said public research including next also,Politics
17,2,22.2,1,0,7,3,4,796,2.6,-0.35,3,president sector policy plan system according state percent including technology said group last growing reported international government,Business
14,2,18.0,0,1,21,3,20,872,3.6,0.103,4,group impact state program new next president world next country could FDA technology world,Health
15,2,21.5,1,0,12,4,51,81,5.0,0.709,1,president company government officials startup report first reported year next health app leader also government,Technology
19,1,26.2,0,0,8,4,217,239,6.3,-0.791,1,security development year many sector percent decision program organization president health recent technology would partisan growing legislation would global,Politics
10,2,12.9,1,1,15,3,87,37,5.9,0.148,1,first first earnings group expected government world could sector system,Business
15,6,8.9,1,0,21,2,100,125,5.4,0.221,0,major year local also local world diagnosis according government report state plan group next recent,Health
17,4,20.8,2,0,4,1,62,4,5.5,-0.231,2,local sector major industry development expected including organization growing public program could health announced state plan year,Entertainment
10,1,16.3,3,0,2,3,48,3,5.3,-0.054,2,government new decision reported telescope plan expected organization recent technology,Science
12,4,17.1,1,1,8,2,9,240,2.8,-0.08,1,local including decision country state next last celebrity policy many system program,Entertainment
18,5,21.7,1,0,8,2,40,902,7.7,-0.128,3,coach world could called recent government expected report public growing reported could government state said called report sector,Sports
15,3,17.3,1,1,8,2,12,186,4.4,-0.292,0,plan impact company said economic first major company concerns government industry local called decision many,Health
17,5,18.3,1,1,2,3,121,6,6.0,0.244,1,economic international president many national impact last report economic year state expected market national sanctions growing organization,World
13,1,16.8,4,0,5,3,1,3058,5.7,0.023,2,summit million expected called local economic state international company next state next would,World
19,4,10.9,0,1,18,4,16,122,5.8,-0.273,3,market program next international group public growing decision announced clinical trial also report last next concerns global organization world,Health
14,3,22.1,0,0,1,1,8,51,9.3,-0.276,2,country recent major security would people next also policy announced genome called many industry,Science
11,4,27.0,1,1,0,2,45,413,5.7,0.243,2,vaccine percent concerns called future organization policy plan state concerns organization,Health
16,3,22.4,0,1,1,4,55,68,7.0,0.642,2,policy major development company refugees company sanctions major expected new would group state sector industry people,World
12,0,14.8,2,0,2,0,3,21,6.1,-0.708,2,first health growing championship report group called report health market policy percent,Sports
13,6,13.4,0,1,0,0,26,0,4.7,0.058,3,international security future growing world public million system technology group clinical trial system,Health
11,0,26.9,1,0,17,1,142,1845,5.7,0.298,4,leader quarterly according decision industry including next organization year last expected,Business
11,4,10.9,0,1,9,1,20,259,11.6,0.445,3,industry last major growing industry next system bipartisan report economic president,Politics
17,0,8.8,0,1,3,4,63,4,3.9,0.509,1,people public security first reported according international policy recent plan premiere world economic sector many state group,Entertainment
10,2,16.8,1,1,23,3,12,185,5.3,-0.12,0,major president state called company report research next country policy,Business
14,9,19.1,0,1,19,3,41,0,8.5,0.448,2,group industry local health according program million president sector sector including called impact could,Politics
15,5,9.9,1,0,7,0,158,23,5.3,-0.275,0,many million according next according growing growing people said research next report last according said,Entertainment
9,3,25.5,1,0,21,3,238,244,4.5,0.088,3,streaming health sector percent research officials leader people policy,Entertainment
10,3,25.2,2,0,8,3,7,55,4.6,-0.636,1,recent sector world future technology including local research development championship,Sports
10,2,15.1,5,1,6,3,74,18,3.2,-0.016,3,announced international impact technology announced decision announced impact athlete also,Sports
10,3,14.0,0,1,1,0,37,2178,1.6,-0.062,0,growing could reported program percent celebrity research announced major first,Entertainment
12,4,22.4,2,0,19,4,30,1,2.6,0.246,3,also global impact many health people smartphone announced concerns percent percent expected,Technology
19,0,9.1,2,0,17,4,173,178,2.5,-0.221,3,NASA international country called expected technology national reported called international growing reported world officials major would global world genome,Science
13,4,14.0,3,1,7,3,65,42,2.7,-0.857,4,new government state plan company technology company research according president world would diplomat,World
16,3,18.6,1,1,15,0,91,34,5.1,-0.324,2,state would global percent country health global research many technology many new decision bipartisan health new,Politics
11,3,16.8,2,0,22,3,37,149,3.3,0.039,3,startup international report percent program reported development research organization could startup,Technology
9,0,14.1,0,1,7,2,101,15,7.3,0.316,1,also reported million premiere million organization also program major,Entertainment
9,1,16.7,1,1,10,0,5,45,7.0,0.036,0,merger percent program year sector new said called sector,Business
10,4,15.2,2,1,4,3,64,31,1.0,0.14,4,group would new year sector officials percent summit global world,World
16,4,17.3,1,0,0,0,155,28,3.8,-0.343,2,public industry market economic global quarterly health called state international many country new many security officials,Business
18,1,11.5,1,1,3,0,34,112,1.0,0.006,2,program health sanctions concerns could plan reported company development reported first million million major leader state future plan,World
9,6,13.1,0,1,19,4,36,34,4.5,-0.14,0,policy including system economic next technology organization algorithm group,Technology
11,7,12.2,1,0,23,0,62,7,3.0,-0.276,1,last athlete policy organization percent million research development expected major research,Sports
16,3,15.9,1,1,19,4,23,6,4.2,0.176,2,app security company technology many public government reported officials officials could percent year decision startup million,Technology
18,3,22.9,1,0,6,1,83,139,5.3,-0.924,1,last officials industry technology public summit sanctions sector report impact said concerns state year impact local next group,World
15,6,18.5,1,1,15,1,49,259,6.2,-0.159,2,sanctions people million diplomat research including called concerns percent economic technology according reported would world,World
9,1,19.9,1,1,22,1,13,223,6.9,0.114,2,public state decision bipartisan development state people system leader,Politics
13,8,22.7,0,0,4,0,39,792,8.7,0.373,1,premiere reported according announced policy international plan plan public box office leader organization,Entertainment
15,3,21.0,1,0,9,1,3,9,4.7,0.238,1,growing global group expected government also system new called smartphone security next research national world,Technology
10,4,19.6,2,1,22,4,22,1,5.8,-0.326,1,clinical trial new industry said technology decision global state industry,Health
13,2,18.5,0,0,11,2,20,165,1.8,0.315,2,FDA percent international decision growing decision decision last technology according local people FDA,Health
17,2,15.7,0,0,16,2,38,37,4.1,-0.07,3,impact according according would major shareholders expected program group plan president year announced global announced expected according,Business
13,3,11.9,2,1,17,3,30,56,6.8,-0.403,0,sector health expected sanctions world growing officials group national state plan country global,World
14,1,23.6,1,1,15,2,52,105,4.2,-0.594,2,decision development world next million concerns many including future could concerns vaccine said people,Health
16,3,8.2,1,0,17,1,50,5,3.8,-0.082,2,research tournament also local sector technology industry major plan officials president million said public officials next,Sports
13,3,20.8,1,1,22,4,39,1688,6.5,0.168,3,merger people major research decision future company called expected said concerns decision would,Business
18,1,19.5,1,0,12,3,87,1,1.0,0.068,0,development next leader technology technology growing according research future leader group could organization health telescope policy announced telescope,Science
12,0,15.0,3,1,7,4,1,9,5.9,-0.017,5,international announced economic international last including technology including bipartisan economic legislation policy,Politics
16,3,11.8,1,1,13,4,16,31,6.1,0.215,4,president state according market plan company system growing plan officials reported global president new plan including,World
10,0,19.4,2,0,11,4,24,43,4.9,-0.172,2,new next world company sector million reported local called market,Business
14,3,23.4,1,1,18,0,3,208,3.4,-0.074,3,recent industry government local president security global bipartisan development global program new including global,Politics
12,1,18.7,0,1,7,3,85,60,4.8,-0.183,3,would next health new health international many future tournament growing plan plan,Sports
17,1,18.0,1,0,8,4,40,5,3.4,0.074,2,international industry decision many merger expected program people concerns recent public national economic concerns policy next future,Business
16,2,15.9,1,1,12,2,77,14,3.6,-0.007,1,also plan international including including policy said global according next first million including system said diplomat,World
13,4,15.1,1,0,21,0,4,84,2.4,-0.543,3,security policy world last market economic according people could diagnosis concerns president plan,Health
10,3,14.6,1,1,23,4,27,25,5.4,0.355,1,year development global global would group sanctions technology first market,World
13,2,21.9,2,0,3,1,36,159,6.7,-0.161,4,also world million said also market decision future report policy earnings leader local,Business
13,1,21.4,2,1,2,0,155,41,5.9,0.109,3,new last world according could decision global quarterly officials also would international many,Business
9,1,25.0,0,0,18,1,32,36,8.0,0.082,4,expected national growing new research technology tournament growing plan,Sports
13,2,22.4,1,1,13,2,15,1591,3.2,-0.24,3,reported health technology new industry economic concerns program international many would technology athlete,Sports
16,3,18.6,3,0,23,3,49,80,9.0,-0.029,2,reported world earnings recent earnings public leader recent plan announced organization international could impact last leader,Business
14,1,27.6,1,0,13,2,5,9,4.4,-0.39,2,national said first people health year international local announced sector championship championship would state,Sports
18,3,20.3,0,1,8,4,43,2174,2.0,0.319,1,called said organization report last earnings company reported including public leader decision would called state system officials local,Business
18,3,11.7,0,0,3,4,59,31,6.4,-0.37,1,including new announced system security could research reported diplomat would called said including group future also last including,World
15,1,32.7,0,1,16,4,13,0,4.4,-0.389,0,year world policy government program company first last vaccine people last sector company said market,Health
14,7,12.8,3,1,0,0,94,41,8.8,0.375,1,reported could concerns million company president diagnosis million program many many organization year called,Health
11,4,17.4,2,0,19,3,62,3,4.5,0.324,1,international leader president public sector program million local market tournament would,Sports
14,3,21.0,0,0,14,4,87,206,5.1,-0.1,2,impact million policy coach million report expected president expected sector system next coach market,Sports
15,4,19.0,2,1,12,0,70,11,1.2,-0.5,3,policy health including program could would expected legislation percent called program research concerns officials world,Politics
14,3,15.0,1,1,20,2,71,65,5.1,-0.047,0,international local said global people could last shareholders research year growing growing growing many,Business
13,5,19.3,1,0,2,0,63,6,4.5,0.51,1,according research year year development major premiere called recent first national government country,Entertainment
18,3,11.6,0,1,15,0,13,642,2.9,0.031,1,million security officials refugees state company future economic state officials national national called country according economic security would,World
12,8,14.8,0,0,21,3,1,345,4.6,-0.548,1,said diplomat last said many state company people technology new president new,World
13,0,16.9,1,1,9,2,145,42,4.9,-0.256,1,people leader reported first world government vaccine security impact concerns sector economic international,Health
15,1,11.8,2,1,17,2,6,0,4.9,0.435,4,million including including people state legislation impact policy government plan new global future research impact,Politics
11,4,11.3,0,1,6,4,3,23,8.1,0.294,2,health called year million million public athlete year million company local,Sports
14,2,8.3,1,0,0,4,87,49,7.2,0.241,3,major public said future including group year economic said last senator research would growing,Politics
15,2,15.6,3,0,10,3,21,40,5.5,-0.227,4,local major could also group group also state next also decision first earnings next president,Business
10,2,15.7,0,1,3,0,13,3,3.3,-0.285,1,expected sector next officials NASA leader expected many reported expected,Science
11,0,19.3,1,1,15,1,67,863,4.2,0.581,3,president market government decision plan world recent market diagnosis world leader,Health
