word_count,num_named_entities,avg_sentence_length,num_quotes,has_numbers,publish_hour,source_type,author_article_count,article_shares,reading_time_minutes,sentiment_score,num_images,article_text,category
17,4,23.1,2,1,16,2,12,48,8.1,-0.11,2,industry report industry decision organization including research international year research impact program said last celebrity future report,Entertainment
16,2,13.2,2,1,22,3,53,3,5.6,-0.344,3,concerns national world could reported security system smartphone impact world called decision impact economic would public,Technology
12,4,23.8,1,0,3,2,2,250,1.0,-0.099,3,year reported research economic people would world international international plan major international,Politics
10,2,20.7,0,0,18,3,49,325,5.3,-0.161,5,million also first major growing industry future economic health startup,Technology
9,2,17.0,0,0,7,4,14,0,2.8,0.243,3,country last president leader national technology officials development app,Technology
11,6,13.2,1,0,10,0,101,497,5.3,0.294,1,president according plan national reported public research public program health smartphone,Technology
10,6,16.6,0,0,22,1,36,137,3.9,-0.016,1,reported called research health development world startup world last technology,Technology
9,6,23.0,1,0,13,1,28,378,8.0,-0.273,3,major system quarterly global people group also system people,Business
16,2,13.0,0,0,12,3,1,2078,3.4,0.246,4,officials could coach concerns plan technology first president health could research next country public people concerns,Sports
14,2,7.5,1,1,21,3,20,2,6.7,-0.571,1,public company million impact economic earnings leader recent said industry new million major recent,Business
15,3,15.7,1,1,19,2,129,29,7.3,-0.105,3,growing many report international state coach global sector industry growing first first reported development would,Sports
13,2,11.7,2,1,16,1,38,220,7.6,-0.199,2,growing sector industry FDA growing decision many also global officials impact market security,Health
15,6,9.4,0,1,22,2,59,913,5.0,-0.471,2,people reported group shareholders percent president including health development health announced report sector future growing,Business
18,3,9.6,0,1,12,1,108,20096,9.9,0.105,2,global growing would according legislation market report research president people system security million major year sector million security,Politics
9,2,17.9,0,1,18,0,2,2,4.0,-0.191,1,technology local report called system organization research economic security,Business
14,0,20.3,3,0,16,4,12,10,2.3,0.153,0,organization major technology local many recent research year development plan algorithm world including development,Technology
16,5,17.4,0,1,21,3,7,181,3.6,0.393,1,decision government million development tournament local plan first international people next announced policy next concerns also,Sports
13,5,21.5,2,1,19,0,48,2,4.1,-0.063,1,sector announced national industry called expected people global sector next according million last,Entertainment
16,4,19.1,0,0,0,0,10,28,8.3,-0.265,1,expected president impact major national percent economic said last concerns celebrity report last announced officials report,Entertainment
13,2,22.1,1,0,3,0,27,3784,2.0,-0.378,5,local development telescope NASA local country national future group government leader called growing,Science
15,5,17.2,0,0,12,3,52,646,8.4,-0.046,2,health technology company announced diagnosis industry development according percent officials people last would many next,Health
15,3,25.7,1,1,4,4,64,185,1.7,0.162,2,quarterly concerns future global world next development merger year country could million new year national,Business
18,2,21.7,2,1,9,0,10,64,5.0,-0.521,2,reported impact system celebrity group company growing million local public development first said industry new last system national,Entertainment
12,3,19.6,1,0,17,3,105,204,2.6,-0.076,2,reported policy research diplomat technology last global national country security policy system,World
16,5,18.8,1,0,7,3,1,2,7.1,0.367,2,policy sector next said many development including legislation national recent global major report officials could would,Politics
11,2,16.6,0,1,17,4,66,45,7.0,0.247,4,first could market people reported leader algorithm impact many research expected,Technology
14,3,13.4,3,0,19,4,50,42,2.1,-0.229,0,million organization group quantum world including growing group according growing decision market said major,Science
12,3,20.6,2,0,12,2,15,417,1.5,-0.825,3,first public concerns market according state report algorithm market president president announced,Technology
10,2,14.9,0,1,14,1,15,44,7.5,-0.542,2,state new leader quantum reported public development million system plan,Science
9,3,23.7,0,1,12,1,54,24,4.1,-0.374,0,state sanctions also year concerns said company country public,World
11,0,22.7,1,1,4,1,54,5,7.0,0.252,2,celebrity impact people organization could policy report public impact decision next,Entertainment
10,2,20.1,0,1,20,2,25,4,4.8,-0.012,0,economic leader future sector organization technology vaccine vaccine system announced,Health
9,3,20.1,1,1,20,4,7,101,2.4,0.337,0,global recent state national startup percent decision economic national,Technology
17,3,20.4,1,0,10,2,25,62,7.7,0.151,6,future public major plan company year security major decision would called company algorithm state reported percent according,Technology
13,3,3.2,1,0,13,0,159,438,3.8,0.112,2,industry global policy development called recent box office reported box office public officials,Entertainment
17,3,29.3,2,1,12,4,20,79,1.4,0.049,4,global market world state reported according earnings according last growing policy government health global security group concerns,Business
18,0,14.1,1,0,11,4,14,140,4.4,-0.396,2,program year program major market according senator policy million expected industry international security market including million group officials,Politics
19,1,22.3,3,1,8,4,17,978,4.0,0.406,3,group last world called group leader announced bipartisan sector market called bipartisan country according year concerns expected could local,Politics
13,5,17.5,2,1,11,4,71,102,7.1,-0.428,3,officials growing next major growing development including said would would genome company economic,Science
12,4,25.3,0,0,3,3,76,14,5.3,0.148,3,including world program refugees leader next said government many also major local,World
16,3,21.5,2,0,12,1,26,88,3.6,0.004,7,national leader impact impact industry organization reported global public diplomat decision technology government industry group company,World
16,4,17.5,3,1,12,0,2,59,3.5,0.181,1,decision year many industry leader report industry market state next plan industry international group million including,Science
16,2,18.9,1,0,0,1,4,24,6.9,0.182,4,economic government market state economic president people called market reported percent economic many partisan growing impact,Politics
10,4,15.0,0,0,19,4,30,12,1.0,0.253,3,new people streaming including development people last company world recent,Entertainment
13,5,16.2,0,0,7,2,17,218,4.0,-0.296,5,expected new development telescope economic report market economic industry recent new major genome,Science
15,1,9.8,0,1,22,4,20,97,4.8,-0.146,1,sector quarterly sector health health public international world plan million reported recent industry sector including,Business
12,3,20.1,0,1,3,2,5,14,6.4,0.435,1,legislation organization local year year year legislation economic growing security world global,Politics
15,1,19.5,1,1,11,4,11,7,5.3,0.282,5,premiere officials president leader year sector leader development leader state percent officials global government group,Entertainment
13,4,17.9,0,1,20,0,13,302,5.8,-0.39,1,would next company system government global world president president leader coach announced impact,Sports
14,4,20.7,0,1,15,2,31,41,6.2,-0.21,2,announced reported international announced economic sanctions health could company report according report group percent,World
8,2,21.1,0,0,4,0,25,0,4.5,0.152,0,industry expected public last major future sector national,Technology
9,4,24.4,1,1,13,2,1,47,4.5,-0.166,2,percent country also development reported growing local system according,World
17,4,22.3,2,0,6,2,23,214,6.2,-0.295,2,market technology program public million plan public decision officials impact sanctions year economic year including according report,World
16,1,16.0,4,0,13,0,13,7349,4.3,0.109,3,first future million state concerns first company also according policy called first reported impact would decision,Health
16,3,21.3,2,1,21,2,9,615,3.6,-0.381,3,according according would called announced group decision industry major million app according year market market said,Technology
10,4,14.7,0,1,11,0,47,116,2.1,0.276,3,year year impact new according economic reported would could expected,Entertainment
10,4,17.2,2,1,9,0,1,4,9.0,0.318,0,announced national policy global public recent plan future officials market,Business
16,4,18.8,1,1,7,2,24,56,4.8,-0.507,1,algorithm technology officials economic decision plan public future development industry expected economic system state technology impact,Technology
15,4,8.7,0,1,8,2,44,28,1.2,0.251,2,smartphone organization concerns public million percent system expected concerns impact reported security including recent organization,Technology
16,3,19.6,0,0,0,1,102,474,4.4,0.603,3,program leader health year legislation people recent year international would sector last world could economic impact,Politics
13,4,20.8,0,1,11,3,248,22,3.8,-0.0,3,said market million security report also policy reported could technology NASA million said,Science
16,3,19.7,0,1,11,0,15,12,6.1,-0.317,1,sector expected health decision decision said system expected economic year said announced according government recent quantum,Science
10,3,9.0,0,1,0,1,87,303,10.0,-0.387,1,called local year local announced announced economic impact government announced,Business
14,3,14.1,0,1,8,2,6,8716,8.6,-0.292,1,sector global technology year decision according global system program growing sanctions global security million,World
18,2,15.5,0,0,23,2,35,32,3.4,0.317,2,genome according according could decision world people next first economic many development program impact said decision national new,Science
12,2,13.1,1,0,15,4,87,1,5.5,0.028,2,research percent expected market leader said company security economic growing market telescope,Science
11,2,20.5,0,1,11,2,22,13,7.0,-0.406,3,concerns plan percent earnings many would many decision concerns said said,Business
11,2,21.6,0,1,1,3,140,192,6.3,-0.168,1,economic future market million report health leader celebrity year economic health,Entertainment
16,0,7.2,3,1,14,1,1,50,7.2,-0.24,2,officials officials state according according global first million group sanctions year state development leader new expected,World
15,1,11.5,1,1,18,2,71,167,7.7,-0.308,0,many public could security said next called leader global expected year first health could sector,Sports
14,4,6.4,1,0,18,1,49,1,1.1,-0.274,0,including many year country officials market impact expected development impact many global impact quantum,Science
17,3,23.0,1,0,3,4,42,154,4.0,-0.008,2,could growing group called world development could local future sanctions public security recent recent new security program,World
8,2,22.8,0,1,3,1,122,10,2.0,0.323,3,concerns impact development concerns new international percent future,World
15,2,14.9,0,1,23,4,144,13,7.8,0.088,3,officials national local tournament would group security year according president said industry would future announced,Sports
11,2,21.0,2,1,16,0,39,31,7.8,-0.279,1,expected including health plan people many economic president national state global,Sports
11,1,13.8,1,1,12,3,81,335,5.5,0.014,1,first including health senator year public local report percent world reported,Politics
15,2,22.9,2,1,2,1,87,14,1.0,0.646,2,earnings future president first many leader recent report according recent new according new merger could,Business
11,2,27.8,2,1,20,3,64,3,4.3,-0.255,1,sector people summit last summit company report concerns major sector reported,World
16,0,16.1,1,1,18,1,66,437,5.2,-0.18,3,called economic algorithm market country percent international concerns sector expected said policy national sector according technology,Technology
19,4,26.6,0,0,13,0,31,88,4.5,0.083,3,could could according world next according last development people global concerns FDA plan expected clinical trial recent percent decision,Health
14,5,14.9,2,1,15,1,3,3,6.5,-0.062,4,leader genome industry people organization policy NASA year report plan expected year future economic,Science
9,8,15.1,1,1,2,0,1,1,2.6,-0.153,0,program research national program last million million recent championship,Sports
12,5,19.2,0,0,20,4,100,87,8.0,0.022,2,company president plan health economic international percent expected sanctions percent last would,World
10,4,17.4,0,1,19,4,68,166,2.1,0.407,1,group president state president could could impact officials expected tournament,Sports
11,2,23.0,0,0,11,1,13,2152,5.9,0.049,4,according shareholders development said system public president according concerns world organization,Business
13,2,18.2,2,1,5,4,12,1323,5.9,0.204,1,government announced sector recent could group streaming said recent future technology technology report,Entertainment
12,2,19.9,2,1,23,4,31,467,4.3,0.011,3,expected leader year next major concerns national industry announced officials major concerns,Technology
10,4,12.6,0,0,2,2,107,393,3.1,-0.008,4,program NASA system world government development reported group global announced,Science
13,4,16.0,1,0,12,0,1,164,5.0,-0.499,1,according growing technology many public percent celebrity could public global world group recent,Entertainment
18,4,18.7,3,1,13,4,47,15,9.4,-0.288,1,group officials health streaming million future health officials leader concerns said global organization decision country government report policy,Entertainment
13,5,21.2,0,1,3,4,23,11,7.8,-0.26,3,security president year report championship sector next research state officials health report expected,Sports
18,3,18.2,0,1,16,2,48,2304,5.3,0.112,2,reported last people sanctions would leader group announced state future company president million growing announced government future economic,World
14,4,23.8,3,1,13,3,44,454,10.1,0.453,1,according state recent country market according health summit reported could state government system health,World
16,1,20.2,3,1,22,2,72,5901,3.6,0.089,2,next including system vaccine said recent development industry group vaccine development reported local system state system,Health
14,2,23.2,0,1,13,3,22,179,2.6,0.421,2,algorithm world next reported national officials people technology million expected next according sector last,Technology
9,4,20.9,0,1,17,3,4,6,4.8,0.054,3,million people athlete million recent company security future organization,Sports
18,2,18.6,1,0,19,3,112,4,2.7,0.061,1,reported organization health policy public national world last recent development major million policy major technology bipartisan growing system,Politics
18,4,16.1,2,0,17,2,43,282,1.3,0.054,0,next market first world including program program growing last could technology expected public sanctions also major officials recent,World
20,1,21.6,1,0,12,2,40,54,2.8,-0.144,3,impact could according new diagnosis government research new new clinical trial research local system officials according impact said also market,Health
17,2,30.5,2,0,9,1,4,66,7.3,0.126,1,said quantum said leader leader including also major officials report industry leader national president quantum impact health,Science
20,5,18.7,1,0,5,0,32,129,5.9,0.531,0,vaccine reported sector according reported plan people including expected economic future reported local according global clinical trial research according international,Health
10,5,21.7,1,1,23,3,74,22,6.5,-0.297,3,would technology sector country next new security leader growing industry,Technology
10,3,7.1,1,1,19,0,16,29,1.2,-0.052,4,including year program country public last said according country people,Politics
17,3,24.0,1,0,10,1,58,2082,5.6,0.018,3,new also officials expected research coach recent company growing local many called president global technology including public,Sports
9,1,31.0,3,0,4,3,52,16,8.9,0.823,4,officials last many future said new said celebrity expected,Entertainment
11,2,22.3,2,0,18,2,27,137,5.1,-0.0,3,shareholders also leader country impact program expected public plan sector research,Business
12,5,17.8,1,1,3,1,153,78,3.6,0.105,3,state earnings local world global development including president decision country could people,Business
12,3,18.9,1,1,2,0,13,6,6.2,-0.49,2,organization percent including report first also senator government leader program last president,Politics
11,4,19.1,0,1,5,0,69,226,5.3,0.331,1,national concerns health future health startup development market officials security economic,Technology
12,3,15.9,2,0,7,4,27,49,5.7,-0.454,2,growing local growing global research percent FDA year company could FDA world,Health
16,1,12.8,0,1,2,4,89,148,4.6,0.028,1,research coach public sector percent sector many plan future next technology major coach industry policy state,Sports
12,2,17.9,0,1,22,1,107,30,5.7,-0.145,2,million public policy global million industry group system impact public impact last,Technology
17,1,22.2,0,1,10,4,5,15,3.7,0.463,5,first system company technology would NASA impact many leader public next organization health people market industry growing,Science
11,5,17.1,0,0,8,1,19,407,3.5,-0.055,0,people state technology national would security genome percent national industry research,Science
15,3,23.9,1,1,19,3,7,17,3.1,0.173,7,state market people major million million could world major people smartphone industry said global last,Technology
17,3,17.3,0,1,0,0,28,75,3.5,-0.102,1,world leader health year announced security expected box office health many would next would officials reported industry,Entertainment
14,2,26.5,2,1,14,1,113,13,5.4,-0.252,2,market impact summit report impact recent recent last major policy government technology plan including,World
14,3,23.8,1,1,3,4,32,363,2.2,-0.063,0,industry government country industry report industry leader market first economic vaccine said sector people,Health
13,2,21.9,1,0,15,3,17,37,3.3,0.601,2,called next president first state market according premiere economic country million year public,Entertainment
16,2,23.5,2,0,12,4,72,46,4.0,-0.161,3,percent percent next people decision concerns including next also summit recent sector growing called world plan,World
13,1,14.5,0,0,18,0,1,171,3.1,-0.125,1,industry world global technology also decision concerns according recent also reported report plan,World
19,6,19.8,0,1,12,3,47,106,4.2,-0.493,2,expected million according could first company security sector announced concerns recent president technology president sanctions industry year diplomat growing,World
18,3,16.2,0,1,16,3,53,15,4.0,-0.137,2,public legislation concerns development including program state including concerns report international president local recent country country international new,Politics
16,1,17.9,1,1,20,4,34,388,5.9,-0.383,1,sector according research public recent country could group government global report vaccine company market future plan,Health
17,7,22.8,1,1,23,4,75,94,7.0,0.333,3,future said program market health decision research also concerns sector concerns new report program percent world concerns,Entertainment
18,2,24.0,2,0,2,2,51,53,5.5,0.182,0,million president impact company technology world report people concerns reported growing many program major state including partisan world,Politics
17,1,12.2,0,0,9,3,94,815,5.3,0.222,1,according officials economic industry president percent coach impact market major reported economic year system health tournament country,Sports
10,3,23.1,1,1,23,3,8,6,3.2,0.006,0,local company organization could impact technology also impact company expected,Technology
14,1,14.0,0,1,3,4,15,6,5.9,0.474,2,development system people security company system year government impact percent sector many major development,Politics
15,2,26.2,1,1,16,3,56,44,6.9,-0.199,1,report industry research telescope industry leader called also research million said development announced industry recent,Science
13,6,11.7,4,1,8,1,46,39,5.8,0.38,1,national security according government research report reported program million economic impact concerns next,Health
9,8,15.2,2,1,8,3,83,145,6.1,0.361,1,major said athlete leader health concerns decision global million,Sports
14,4,21.5,1,1,0,1,71,73,4.5,0.537,2,concerns percent concerns officials expected economic percent according according tournament million officials research next,Sports
17,2,17.7,1,1,4,2,24,100,8.6,0.22,1,first group decision market system future would report development system called industry industry million health plan officials,Technology
9,1,18.6,0,1,16,2,28,738,5.5,0.09,4,growing decision system state market global development merger world,Business
18,1,12.1,0,1,6,4,54,16,5.8,0.077,5,next sector impact according national announced technology called international major app local called major leader public concerns technology,Technology
16,4,20.6,3,0,23,1,45,49,1.7,0.199,4,algorithm last health first system called also including local international many new national future local said,Technology
10,5,19.2,2,1,22,1,86,39,5.3,0.09,0,national industry would championship recent also major million development global,Sports
11,4,11.7,2,1,15,0,20,13,6.9,-0.234,3,national next organization growing sector local next future reported diplomat reported,World
15,1,16.5,0,0,22,3,20,6,4.8,-0.375,5,international company people sanctions impact group officials company development report government many group reported industry,World
13,2,7.2,1,0,0,4,29,42,4.0,0.196,1,research could sanctions world sector called system development new state system president million,World
11,1,23.4,1,1,1,0,9,3,2.0,0.044,1,program expected market leader bipartisan major local year market system security,Politics
10,1,10.4,1,1,15,3,55,12,5.4,-0.061,2,new world world percent last next announced future box office,Entertainment
15,2,17.5,0,1,7,4,110,511,6.1,-0.105,0,local would report development said health group president technology program new economic including program next,Health
10,5,22.9,1,0,15,0,1,76,4.6,0.313,4,future tournament president development world impact leader plan percent future,Sports
15,5,10.9,0,1,19,1,14,115,4.9,-0.08,3,organization shareholders concerns major company new people plan president last global state country organization leader,Business
14,6,18.0,0,1,7,1,42,136,3.1,0.033,3,announced according economic local called genome first percent global world first world major people,Science
12,3,13.3,3,1,6,0,31,35,7.1,-0.102,1,research global called organization government state country expected according program officials new,Technology
11,1,21.6,0,1,10,4,120,304,5.0,0.195,1,system new including world quarterly would reported country international world research,Business
16,0,15.1,0,1,4,2,49,7,2.0,-0.337,3,national sector group athlete leader called group industry first growing industry decision reported research first championship,Sports
12,4,7.5,2,0,1,4,38,9,4.4,-0.393,4,partisan global public policy last world according group percent group research partisan,Politics
17,0,17.8,5,1,5,3,19,10,3.1,-0.42,0,government expected last market according smartphone app health said government impact research plan global organization growing also,Technology
13,1,19.3,0,0,10,2,40,150,4.2,-0.697,1,called streaming government group development also also officials country global health local technology,Entertainment
9,2,23.0,1,0,5,3,117,74,3.1,-0.541,2,could recent security including recent state last NASA development,Science
14,3,27.2,0,1,5,2,24,35,3.3,0.219,4,also people would group public expected called program officials expected plan global state called,Business
10,1,5.9,0,1,20,1,103,155,4.9,-0.012,3,sector security legislation announced expected also major could plan technology,Politics
13,3,17.5,1,0,4,1,77,8,4.8,-0.705,3,year percent plan last economic people including policy international impact reported future decision,Technology
11,7,14.8,2,1,22,2,133,168,8.5,0.177,3,officials would clinical trial also called global local announced state people,Health
11,2,15.8,1,0,10,2,95,346,4.9,-0.189,3,international legislation year organization organization research country next national major economic,Politics
12,1,24.9,0,1,5,3,31,75,4.9,-0.168,2,million major tournament program future global recent announced industry concerns development first,Sports
18,5,19.4,0,1,14,3,77,242,1.0,-0.157,3,officials growing country announced policy research plan called policy last many sector decision program system organization shareholders research,Business
16,5,9.9,1,1,12,2,14,1465,5.2,-0.111,0,development government million local recent policy last last also people technology concerns impact market box office,Entertainment
10,3,13.5,0,1,8,4,36,1634,4.9,-0.52,1,growing country many next called championship decision recent new president,Sports
15,7,22.9,2,1,7,2,113,153,3.0,-0.202,4,according country technology diagnosis new announced report impact future including decision including concerns plan plan,Health
12,2,12.6,0,1,16,4,87,177,6.9,0.388,0,country sector state system public leader national box office according security expected,Entertainment
9,7,16.4,1,1,10,2,46,42,1.5,0.265,5,impact people last announced global diagnosis public system last,Health
15,3,15.1,1,1,10,2,31,116,4.2,-0.455,2,box office global million international research security research international reported state development last international also,Entertainment
13,2,21.9,0,1,13,0,98,11,7.6,-0.008,3,decision first announced sector growing could clinical trial government first could million industry,Health
18,3,15.1,1,1,19,3,55,81,5.1,0.185,0,health million national major last bipartisan industry report would president group also state new group according many health,Politics
